{
  "target_id": 34,
  "version": 3,
  "filter": "Ha",
  "sha256": "4b1e2d3c4a5f6e7d8c9b0a1f2e3d4c5b6a7f8e9d0c1b2a3f4e5d6c7b8a9f0e1d",
  "size_bytes": 302000000,
  "archive_uri": "s3://observatory-archive/projects/esprit100_2600mm/T34_m31/multi/Ha/v3/master.xisf",
  "nas_path": null,
  "metrics": {
    "frames": 288,
    "rejected": 11,
    "total_exposure_s": 83100,
    "night_weights": {
      "2026-09-22": 0.8,
      "2026-09-23": 1.0,
      "2026-09-24": 0.95
    }
  },
  "supersedes_altair_id": 412
}
