{
  "target_id": 34,
  "night": "2026-09-24",
  "version": null,
  "filter": "Ha",
  "sha256": "0c1d2e3f4a5b6c7d8e9f0a1b2c3d4e5f6a7b8c9d0e1f2a3b4c5d6e7f8a9b0c1d",
  "size_bytes": 301989888,
  "archive_uri": "s3://observatory-archive/projects/esprit100_2600mm/T34_m31/nights/2026-09-24/Ha/master.xisf",
  "nas_path": "projects/esprit100_2600mm/T34_m31/nights/2026-09-24/Ha/master.xisf",
  "metrics": {
    "frames": 96,
    "rejected": 4,
    "total_exposure_s": 27600,
    "fwhm": 2.38,
    "eccentricity": 0.41,
    "snr": 61.2
  },
  "supersedes_altair_id": null,
  "calibrated_bundle": {
    "sha256": "9a8b7c6d5e4f3a2b1c0d9e8f7a6b5c4d3e2f1a0b9c8d7e6f5a4b3c2d1e0f9a8b",
    "size_bytes": 9663676416,
    "archive_uri": "s3://observatory-archive/projects/esprit100_2600mm/T34_m31/nights/2026-09-24/Ha/calibrated_9a8b7c6d.zip",
    "frames": 96
  }
}
